{
  "schema_version": 1,
  "schema_id": "cargo-allow.exact-candidate-package-set.v1",
  "tool": "cargo-allow",
  "result": "Passed",
  "claim_boundary": [
    "exact_thirteen_crate_package_graph",
    "classic_transitive_local_registry_offline_install",
    "source_checkout_denied_during_decisive_install",
    "source_candidate_not_published_install_journey"
  ],
  "candidate": {
    "workspace_version": "0.2.0",
    "crate_set_schema_id": "cargo-allow.candidate-crate-set.v1",
    "git_head": "0000000000000000000000000000000000000000"
  },
  "environment": {
    "os": "linux",
    "arch": "x86_64",
    "rustc_version": null,
    "cargo_version": null,
    "network_posture": "fetch_warm_may_use_crates_io_then_offline_install",
    "isolation_mechanism": "local_registry"
  },
  "package_set": {
    "order": [
      "allow-core",
      "allow-policy",
      "allow-inventory",
      "allow-files",
      "allow-rust",
      "allow-match",
      "allow-report",
      "allow-policy-legacy",
      "allow-diff",
      "effortless-repo-protocol",
      "effortless-repo-snapshot",
      "effortless-repo-edit",
      "cargo-allow"
    ],
    "crates": [
      {
        "name": "allow-core",
        "version": "0.2.0",
        "crate_file": "allow-core-0.2.0.crate",
        "sha256": "0123456789abcdef0123456789abcdef0123456789abcdef0123456789abcdef",
        "size_bytes": 1,
        "extracted_dir": "allow-core-0.2.0",
        "no_path_deps": true
      },
      {
        "name": "allow-policy",
        "version": "0.2.0",
        "crate_file": "allow-policy-0.2.0.crate",
        "sha256": "0123456789abcdef0123456789abcdef0123456789abcdef0123456789abcdef",
        "size_bytes": 1,
        "extracted_dir": "allow-policy-0.2.0",
        "no_path_deps": true
      },
      {
        "name": "allow-inventory",
        "version": "0.2.0",
        "crate_file": "allow-inventory-0.2.0.crate",
        "sha256": "0123456789abcdef0123456789abcdef0123456789abcdef0123456789abcdef",
        "size_bytes": 1,
        "extracted_dir": "allow-inventory-0.2.0",
        "no_path_deps": true
      },
      {
        "name": "allow-files",
        "version": "0.2.0",
        "crate_file": "allow-files-0.2.0.crate",
        "sha256": "0123456789abcdef0123456789abcdef0123456789abcdef0123456789abcdef",
        "size_bytes": 1,
        "extracted_dir": "allow-files-0.2.0",
        "no_path_deps": true
      },
      {
        "name": "allow-rust",
        "version": "0.2.0",
        "crate_file": "allow-rust-0.2.0.crate",
        "sha256": "0123456789abcdef0123456789abcdef0123456789abcdef0123456789abcdef",
        "size_bytes": 1,
        "extracted_dir": "allow-rust-0.2.0",
        "no_path_deps": true
      },
      {
        "name": "allow-match",
        "version": "0.2.0",
        "crate_file": "allow-match-0.2.0.crate",
        "sha256": "0123456789abcdef0123456789abcdef0123456789abcdef0123456789abcdef",
        "size_bytes": 1,
        "extracted_dir": "allow-match-0.2.0",
        "no_path_deps": true
      },
      {
        "name": "allow-report",
        "version": "0.2.0",
        "crate_file": "allow-report-0.2.0.crate",
        "sha256": "0123456789abcdef0123456789abcdef0123456789abcdef0123456789abcdef",
        "size_bytes": 1,
        "extracted_dir": "allow-report-0.2.0",
        "no_path_deps": true
      },
      {
        "name": "allow-policy-legacy",
        "version": "0.2.0",
        "crate_file": "allow-policy-legacy-0.2.0.crate",
        "sha256": "0123456789abcdef0123456789abcdef0123456789abcdef0123456789abcdef",
        "size_bytes": 1,
        "extracted_dir": "allow-policy-legacy-0.2.0",
        "no_path_deps": true
      },
      {
        "name": "allow-diff",
        "version": "0.2.0",
        "crate_file": "allow-diff-0.2.0.crate",
        "sha256": "0123456789abcdef0123456789abcdef0123456789abcdef0123456789abcdef",
        "size_bytes": 1,
        "extracted_dir": "allow-diff-0.2.0",
        "no_path_deps": true
      },
      {
        "name": "effortless-repo-protocol",
        "version": "0.1.0",
        "crate_file": "effortless-repo-protocol-0.1.0.crate",
        "sha256": "0123456789abcdef0123456789abcdef0123456789abcdef0123456789abcdef",
        "size_bytes": 1,
        "extracted_dir": "effortless-repo-protocol-0.1.0",
        "no_path_deps": true
      },
      {
        "name": "effortless-repo-snapshot",
        "version": "0.1.0",
        "crate_file": "effortless-repo-snapshot-0.1.0.crate",
        "sha256": "0123456789abcdef0123456789abcdef0123456789abcdef0123456789abcdef",
        "size_bytes": 1,
        "extracted_dir": "effortless-repo-snapshot-0.1.0",
        "no_path_deps": true
      },
      {
        "name": "effortless-repo-edit",
        "version": "0.1.0",
        "crate_file": "effortless-repo-edit-0.1.0.crate",
        "sha256": "0123456789abcdef0123456789abcdef0123456789abcdef0123456789abcdef",
        "size_bytes": 1,
        "extracted_dir": "effortless-repo-edit-0.1.0",
        "no_path_deps": true
      },
      {
        "name": "cargo-allow",
        "version": "0.2.0",
        "crate_file": "cargo-allow-0.2.0.crate",
        "sha256": "0123456789abcdef0123456789abcdef0123456789abcdef0123456789abcdef",
        "size_bytes": 1,
        "extracted_dir": "cargo-allow-0.2.0",
        "no_path_deps": true
      }
    ]
  },
  "isolation": {
    "fresh_cargo_home": true,
    "install_from_extracted_package": true,
    "internal_deps_patched": false,
    "workspace_paths_absent": true,
    "source_checkout_denied": true
  },
  "install": {
    "method": "cargo_install_path_extracted_with_local_registry",
    "version_output": "cargo-allow 0.2.0",
    "exit_code": 0,
    "binary_sha256": "9a2b7ce54e17aaba0e2ee0a504f44b2d7321c15ad844b214c0a75ac7b88c5fbb"
  },
  "negative_controls": [
    {
      "id": "omit_internal_crate_from_patch",
      "result_class": "SourceFallbackDetected",
      "passed": true,
      "detail": "omitting allow-core from [patch.crates-io] resolves registry or fails closed"
    },
    {
      "id": "workspace_path_install_rejected",
      "result_class": "WorkspacePathLeak",
      "passed": true,
      "detail": "decisive install uses extracted package path, not crates/cargo-allow"
    },
    {
      "id": "package_checksum_mutation_after_inventory",
      "result_class": "PackageChecksumMismatch",
      "passed": true,
      "detail": "mutating allow-core.crate after inventory changes sha256 vs recorded digest"
    },
    {
      "id": "injected_normalized_path_dependency",
      "result_class": "WorkspacePathLeak",
      "passed": true,
      "detail": "path= dependency injected into normalized allow-core manifest is detected"
    },
    {
      "id": "older_internal_package_version",
      "result_class": "InternalVersionConflict",
      "passed": true,
      "detail": "patching allow-core to an incompatible version yields InternalVersionConflict"
    },
    {
      "id": "omit_candidate_from_local_registry",
      "result_class": "PackageMissing",
      "passed": true,
      "detail": "removing allow-core from local-registry fails offline resolve (PackageMissing)"
    },
    {
      "id": "candidate_commit_or_version_mismatch",
      "result_class": "CandidateStale",
      "passed": true,
      "detail": "forged candidate git_head/version vs packaged set classifies CandidateStale"
    },
    {
      "id": "missing_required_package_metadata_or_file",
      "result_class": "ManifestMalformed",
      "passed": true,
      "detail": "stripped license and missing README.md in normalized allow-core classifies ManifestMalformed"
    },
    {
      "id": "decisive_install_source_checkout_denied",
      "result_class": "CheckoutIsolated",
      "passed": true,
      "detail": "decisive offline install succeeds while workspace crates/ is renamed away (CheckoutIsolated)"
    }
  ],
  "limitations": [
    "fetch_warm_may_use_crates_io",
    "linux_hosted_claim_only"
  ]
}
